{
  "schemaVersion": "1.0.0",
  "snapshotId": "snapshot-20261027T212153-window-cadence-20261028",
  "generatedAt": "2026-10-27T21:21:53.600233+00:00",
  "sourceRunId": [
    "runtime-20261028-013539",
    "runtime-20261028-013820",
    "runtime-20261028-014722",
    "runtime-20261028-015001",
    "runtime-20261028-021529",
    "runtime-20261028-021953",
    "runtime-20261028-053114",
    "runtime-20261028-053554",
    "runtime-20261028-055226",
    "runtime-20261028-061023",
    "runtime-20261028-061615"
  ],
  "buildId": [
    "102757EC9542DEFBB1EE65BDD18FFC7429DD62171B3B5DBECF3227CC43A17461",
    "3BE027E66461D9015ACAEEAE6109C5626CE93DBFF363EB0F5B0ACE8F7F5DB6CF",
    "3ECCE4F140E8A5A7F1081D657EEFA3EB875717D9050E0554F23C94E1ABE941EC",
    "B8FBAB746F50CB7C8BDBB23E059C308298CEA5F57B4AC6BD0F2DDEBC55B8C185"
  ],
  "verificationStatus": {
    "diagnosisSucceeded": true,
    "experimentSuccess": false,
    "finalAccepted": false,
    "functional": "Previous B8FB64 final arrivals observed; new passive8 attempt not accepted under low cadence; full shadow not exercised",
    "visual": "No new visible-frame quality measurement; CPU/visible mismatch unresolved",
    "performance": "Single window activation control median259->20ms; not optimization; native/GPU cause and20ms p95 target unaccepted",
    "regressionChecks": 74
  },
  "metrics": [
    {
      "metricId": "finalArrivals",
      "sourceRunId": "runtime-20261028-021529",
      "buildId": "3ECCE4F140E8A5A7F1081D657EEFA3EB875717D9050E0554F23C94E1ABE941EC",
      "value": 8,
      "unit": "agents",
      "conditions": {
        "logicalAgents": 8,
        "scenario": "activeReference",
        "durationSeconds": 180,
        "frameSync": "on",
        "detailedInstrumentation": true,
        "method": "mission frame delta; not GPU/Present",
        "normalExit": true
      },
      "repetitions": 1,
      "verificationStatus": "diagnosis_only"
    },
    {
      "metricId": "highHoldMissing",
      "sourceRunId": "runtime-20261028-021529",
      "buildId": "3ECCE4F140E8A5A7F1081D657EEFA3EB875717D9050E0554F23C94E1ABE941EC",
      "value": 0,
      "unit": "agents",
      "conditions": {
        "logicalAgents": 8,
        "scenario": "activeReference",
        "durationSeconds": 180,
        "frameSync": "on",
        "detailedInstrumentation": true,
        "method": "mission frame delta; not GPU/Present",
        "normalExit": true
      },
      "repetitions": 1,
      "verificationStatus": "diagnosis_only"
    },
    {
      "metricId": "fallsLandedAndResumed",
      "sourceRunId": "runtime-20261028-021529",
      "buildId": "3ECCE4F140E8A5A7F1081D657EEFA3EB875717D9050E0554F23C94E1ABE941EC",
      "value": 10,
      "unit": "events",
      "conditions": {
        "logicalAgents": 8,
        "scenario": "activeReference",
        "durationSeconds": 180,
        "frameSync": "on",
        "detailedInstrumentation": true,
        "method": "mission frame delta; not GPU/Present",
        "normalExit": true
      },
      "repetitions": 1,
      "verificationStatus": "diagnosis_only"
    },
    {
      "metricId": "newReapproachEpisodes",
      "sourceRunId": "runtime-20261028-021529",
      "buildId": "3ECCE4F140E8A5A7F1081D657EEFA3EB875717D9050E0554F23C94E1ABE941EC",
      "value": 0,
      "unit": "events",
      "conditions": {
        "logicalAgents": 8,
        "scenario": "activeReference",
        "durationSeconds": 180,
        "frameSync": "on",
        "detailedInstrumentation": true,
        "method": "mission frame delta; not GPU/Present",
        "normalExit": true
      },
      "repetitions": 1,
      "verificationStatus": "diagnosis_only"
    },
    {
      "metricId": "missionFrameTime.p50",
      "sourceRunId": "runtime-20261028-021529",
      "buildId": "3ECCE4F140E8A5A7F1081D657EEFA3EB875717D9050E0554F23C94E1ABE941EC",
      "value": 20.0,
      "unit": "ms",
      "conditions": {
        "logicalAgents": 8,
        "scenario": "activeReference",
        "durationSeconds": 180,
        "frameSync": "on",
        "detailedInstrumentation": true,
        "method": "mission frame delta; not GPU/Present",
        "normalExit": true
      },
      "repetitions": 1,
      "verificationStatus": "diagnosis_only"
    },
    {
      "metricId": "missionFrameTime.p95",
      "sourceRunId": "runtime-20261028-021529",
      "buildId": "3ECCE4F140E8A5A7F1081D657EEFA3EB875717D9050E0554F23C94E1ABE941EC",
      "value": 33.0,
      "unit": "ms",
      "conditions": {
        "logicalAgents": 8,
        "scenario": "activeReference",
        "durationSeconds": 180,
        "frameSync": "on",
        "detailedInstrumentation": true,
        "method": "mission frame delta; not GPU/Present",
        "normalExit": true
      },
      "repetitions": 1,
      "verificationStatus": "diagnosis_only"
    },
    {
      "metricId": "missionFrameTime.p99",
      "sourceRunId": "runtime-20261028-021529",
      "buildId": "3ECCE4F140E8A5A7F1081D657EEFA3EB875717D9050E0554F23C94E1ABE941EC",
      "value": 34.0,
      "unit": "ms",
      "conditions": {
        "logicalAgents": 8,
        "scenario": "activeReference",
        "durationSeconds": 180,
        "frameSync": "on",
        "detailedInstrumentation": true,
        "method": "mission frame delta; not GPU/Present",
        "normalExit": true
      },
      "repetitions": 1,
      "verificationStatus": "diagnosis_only"
    },
    {
      "metricId": "finalArrivals",
      "sourceRunId": "runtime-20261028-021953",
      "buildId": "3ECCE4F140E8A5A7F1081D657EEFA3EB875717D9050E0554F23C94E1ABE941EC",
      "value": 64,
      "unit": "agents",
      "conditions": {
        "logicalAgents": 64,
        "scenario": "activeReference",
        "durationSeconds": 300,
        "frameSync": "on",
        "detailedInstrumentation": true,
        "method": "mission frame delta; not GPU/Present",
        "normalExit": true
      },
      "repetitions": 1,
      "verificationStatus": "diagnosis_only"
    },
    {
      "metricId": "highHoldMissing",
      "sourceRunId": "runtime-20261028-021953",
      "buildId": "3ECCE4F140E8A5A7F1081D657EEFA3EB875717D9050E0554F23C94E1ABE941EC",
      "value": 11,
      "unit": "agents",
      "conditions": {
        "logicalAgents": 64,
        "scenario": "activeReference",
        "durationSeconds": 300,
        "frameSync": "on",
        "detailedInstrumentation": true,
        "method": "mission frame delta; not GPU/Present",
        "normalExit": true
      },
      "repetitions": 1,
      "verificationStatus": "diagnosis_only"
    },
    {
      "metricId": "fallsLandedAndResumed",
      "sourceRunId": "runtime-20261028-021953",
      "buildId": "3ECCE4F140E8A5A7F1081D657EEFA3EB875717D9050E0554F23C94E1ABE941EC",
      "value": 77,
      "unit": "events",
      "conditions": {
        "logicalAgents": 64,
        "scenario": "activeReference",
        "durationSeconds": 300,
        "frameSync": "on",
        "detailedInstrumentation": true,
        "method": "mission frame delta; not GPU/Present",
        "normalExit": true
      },
      "repetitions": 1,
      "verificationStatus": "diagnosis_only"
    },
    {
      "metricId": "newReapproachEpisodes",
      "sourceRunId": "runtime-20261028-021953",
      "buildId": "3ECCE4F140E8A5A7F1081D657EEFA3EB875717D9050E0554F23C94E1ABE941EC",
      "value": 0,
      "unit": "events",
      "conditions": {
        "logicalAgents": 64,
        "scenario": "activeReference",
        "durationSeconds": 300,
        "frameSync": "on",
        "detailedInstrumentation": true,
        "method": "mission frame delta; not GPU/Present",
        "normalExit": true
      },
      "repetitions": 1,
      "verificationStatus": "diagnosis_only"
    },
    {
      "metricId": "missionFrameTime.p50",
      "sourceRunId": "runtime-20261028-021953",
      "buildId": "3ECCE4F140E8A5A7F1081D657EEFA3EB875717D9050E0554F23C94E1ABE941EC",
      "value": 25.0,
      "unit": "ms",
      "conditions": {
        "logicalAgents": 64,
        "scenario": "activeReference",
        "durationSeconds": 300,
        "frameSync": "on",
        "detailedInstrumentation": true,
        "method": "mission frame delta; not GPU/Present",
        "normalExit": true
      },
      "repetitions": 1,
      "verificationStatus": "diagnosis_only"
    },
    {
      "metricId": "missionFrameTime.p95",
      "sourceRunId": "runtime-20261028-021953",
      "buildId": "3ECCE4F140E8A5A7F1081D657EEFA3EB875717D9050E0554F23C94E1ABE941EC",
      "value": 59.0,
      "unit": "ms",
      "conditions": {
        "logicalAgents": 64,
        "scenario": "activeReference",
        "durationSeconds": 300,
        "frameSync": "on",
        "detailedInstrumentation": true,
        "method": "mission frame delta; not GPU/Present",
        "normalExit": true
      },
      "repetitions": 1,
      "verificationStatus": "diagnosis_only"
    },
    {
      "metricId": "missionFrameTime.p99",
      "sourceRunId": "runtime-20261028-021953",
      "buildId": "3ECCE4F140E8A5A7F1081D657EEFA3EB875717D9050E0554F23C94E1ABE941EC",
      "value": 82.0,
      "unit": "ms",
      "conditions": {
        "logicalAgents": 64,
        "scenario": "activeReference",
        "durationSeconds": 300,
        "frameSync": "on",
        "detailedInstrumentation": true,
        "method": "mission frame delta; not GPU/Present",
        "normalExit": true
      },
      "repetitions": 1,
      "verificationStatus": "diagnosis_only"
    },
    {
      "metricId": "cpuPoseRecurrence",
      "sourceRunId": "runtime-20261028-013539",
      "buildId": "3BE027E66461D9015ACAEEAE6109C5626CE93DBFF363EB0F5B0ACE8F7F5DB6CF",
      "value": 3.24,
      "unit": "s",